{
  "files": {
    "prompt": "prompt.md",
    "receipt": "run-card.json",
    "recipe": "recipe.json",
    "reproduce": "REPRODUCE.md",
    "result": "result.md",
    "setup": "setup.md"
  },
  "kind": "recipe",
  "privacy": {
    "credentials_removed": true,
    "local_paths_removed": true,
    "repository_names_removed": true,
    "run_card_only": true,
    "synthetic_or_publishable_input": true
  },
  "provenance": {
    "author": "LightClaw maintainers",
    "publication_consent": true,
    "source": "built-in deterministic multi-agent demo",
    "type": "maintainer-fixture"
  },
  "schema_version": 1,
  "slug": "audited-multi-agent",
  "summary": "Replay a two-lane dependency, a failed check, one bounded repair, and final audit.",
  "title": "Audited multi-agent handoff"
}

